[
  {
    "id": "person-1",
    "group": "faculty",
    "image": "https://pkuaimi.com/wp-content/uploads/2025/08/4F80C926-1919-4506-9A45-BEA609538E0F.png",
    "profilePath": "/people/yixing-huang/",
    "en": {
      "name": "Asst. Prof. Dr.-Ing. Yixing Huang"
    },
    "zh": {
      "name": "黄益星（助理教授、工学博士）"
    }
  },
  {
    "id": "person-2",
    "group": "postdocs",
    "image": "https://pkuaimi.com/wp-content/uploads/2025/12/2698-51x51-2.jpg",
    "profilePath": "/people/haijun-yu/",
    "en": {
      "name": "Dr. Haijun Yu"
    },
    "zh": {
      "name": "余海军博士"
    }
  },
  {
    "id": "person-3",
    "group": "postdocs",
    "image": "https://pkuaimi.com/wp-content/uploads/2026/03/%E6%9D%8E%E8%90%8C1.jpg",
    "profilePath": "/people/meng-li/",
    "en": {
      "name": "Dr. Meng Li"
    },
    "zh": {
      "name": "李萌博士"
    }
  },
  {
    "id": "person-4",
    "group": "assistants",
    "image": "https://pkuaimi.com/wp-content/uploads/2026/06/%E4%BD%99%E7%BD%97%E4%B8%80%E5%8C%A1.jpg",
    "profilePath": null,
    "en": {
      "name": "YiKuang YuLuo"
    },
    "zh": {
      "name": "余罗一匡"
    }
  },
  {
    "id": "person-5",
    "group": "assistants",
    "image": "https://pkuaimi.com/wp-content/uploads/2026/06/%E8%91%A3%E5%AD%90%E7%BB%B4.jpg",
    "profilePath": null,
    "en": {
      "name": "ZiWei Dong"
    },
    "zh": {
      "name": "董子维"
    }
  },
  {
    "id": "person-6",
    "group": "phd",
    "image": "https://pkuaimi.com/wp-content/uploads/2025/10/%E5%BE%AE%E4%BF%A1%E5%9B%BE%E7%89%87_20251022152516_98_40-1.jpg",
    "profilePath": "/people/ao-wang/",
    "en": {
      "name": "Ao Wang"
    },
    "zh": {
      "name": "王奥"
    }
  },
  {
    "id": "person-7",
    "group": "phd",
    "image": "https://pkuaimi.com/wp-content/uploads/2025/11/%E7%85%A7%E7%89%872.png",
    "profilePath": null,
    "en": {
      "name": "ZuoDong Zhong"
    },
    "zh": {
      "name": "钟祚栋"
    }
  },
  {
    "id": "person-8",
    "group": "masters",
    "image": "https://pkuaimi.com/wp-content/uploads/2025/08/%E9%92%9F%E5%8F%8C%E9%98%B3.jpg",
    "profilePath": null,
    "en": {
      "name": "ShuangYang Zhong"
    },
    "zh": {
      "name": "钟双阳"
    }
  },
  {
    "id": "person-9",
    "group": "masters",
    "image": "https://pkuaimi.com/wp-content/uploads/2025/11/%E5%94%90%E4%BD%B3%E6%99%A8%E7%85%A7%E7%89%87.jpg",
    "profilePath": null,
    "en": {
      "name": "JiaChen Tang"
    },
    "zh": {
      "name": "唐佳晨"
    }
  },
  {
    "id": "person-10",
    "group": "visiting",
    "image": "https://pkuaimi.com/wp-content/uploads/2026/04/%E7%85%A7%E7%89%87.jpg",
    "profilePath": null,
    "en": {
      "name": "YuJie Liu"
    },
    "zh": {
      "name": "刘雨洁"
    }
  },
  {
    "id": "person-11",
    "group": "bachelors",
    "image": "https://pkuaimi.com/wp-content/uploads/2025/11/%E5%BC%A0%E7%8E%89%E9%9B%AF.jpg",
    "profilePath": null,
    "en": {
      "name": "YuWen Zhang"
    },
    "zh": {
      "name": "张玉雯"
    }
  },
  {
    "id": "person-12",
    "group": "bachelors",
    "image": "https://pkuaimi.com/wp-content/uploads/2025/11/%E7%B4%A2%E6%9C%97%E6%8E%AA%E5%A7%86.jpg",
    "profilePath": null,
    "en": {
      "name": "CuoMu SuoLang"
    },
    "zh": {
      "name": "索朗措姆"
    }
  },
  {
    "id": "person-13",
    "group": "bachelors",
    "image": "https://pkuaimi.com/wp-content/uploads/2025/11/%E9%AD%8F%E4%B8%80%E7%A6%BE2.png",
    "profilePath": null,
    "en": {
      "name": "YiHe Wei"
    },
    "zh": {
      "name": "魏一禾"
    }
  },
  {
    "id": "person-shijie-hou",
    "group": "bachelors",
    "image": "/assets/shijie-hou.jpg",
    "profilePath": null,
    "en": {
      "name": "ShiJie Hou"
    },
    "zh": {
      "name": "候士杰"
    }
  },
  {
    "id": "person-wenqi-zhang",
    "group": "bachelors",
    "image": "/assets/wenqi-zhang.jpg",
    "profilePath": null,
    "en": {
      "name": "WenQi Zhang"
    },
    "zh": {
      "name": "张文起"
    }
  },
  {
    "id": "person-yiteng-ji",
    "group": "bachelors",
    "image": "/assets/yiteng-ji.jpg",
    "profilePath": null,
    "en": {
      "name": "YiTeng Ji"
    },
    "zh": {
      "name": "纪抑腾"
    }
  },
  {
    "id": "person-shiqi-fan",
    "group": "bachelors",
    "image": "/assets/shiqi-fan.jpg",
    "profilePath": null,
    "en": {
      "name": "ShiQi Fan"
    },
    "zh": {
      "name": "樊师祁"
    }
  },
  {
    "id": "person-14",
    "group": "alumni",
    "image": "https://pkuaimi.com/wp-content/uploads/2026/06/%E6%A2%85%E6%80%9D%E8%BF%9C.jpg",
    "profilePath": null,
    "en": {
      "name": "SiYuan Mei"
    },
    "zh": {
      "name": "梅思远"
    }
  },
  {
    "id": "person-15",
    "group": "alumni",
    "image": "https://pkuaimi.com/wp-content/uploads/2026/02/%E9%AD%8F%E4%BD%B3.jpg",
    "profilePath": null,
    "en": {
      "name": "Jia Wei"
    },
    "zh": {
      "name": "魏佳"
    }
  },
  {
    "id": "person-16",
    "group": "alumni",
    "image": "https://pkuaimi.com/wp-content/uploads/2025/11/%E7%8E%8B%E5%AD%90%E8%B1%AA.jpg",
    "profilePath": null,
    "en": {
      "name": "ZiHao Wang"
    },
    "zh": {
      "name": "王子豪"
    }
  },
  {
    "id": "person-17",
    "group": "alumni",
    "image": "https://pkuaimi.com/wp-content/uploads/2025/12/%E6%9D%A8%E9%9B%A8%E8%BE%B0.jpg",
    "profilePath": null,
    "en": {
      "name": "YuChen Yang"
    },
    "zh": {
      "name": "杨雨辰"
    }
  },
  {
    "id": "person-18",
    "group": "alumni",
    "image": "https://pkuaimi.com/wp-content/uploads/2025/11/%E5%88%98%E8%95%8A.jpg",
    "profilePath": null,
    "en": {
      "name": "Rui Liu"
    },
    "zh": {
      "name": "刘蕊"
    }
  },
  {
    "id": "person-19",
    "group": "alumni",
    "image": "https://pkuaimi.com/wp-content/uploads/2025/11/%E4%BD%95%E6%9C%9D%E8%89%AF.jpg",
    "profilePath": null,
    "en": {
      "name": "ChaoLiang He"
    },
    "zh": {
      "name": "何朝良"
    }
  },
  {
    "id": "person-20",
    "group": "alumni",
    "image": "https://pkuaimi.com/wp-content/uploads/2025/10/b5cd0790-a404-45f8-852d-9c02e0c392ab.png",
    "profilePath": null,
    "en": {
      "name": "Song Ni"
    },
    "zh": {
      "name": "倪松"
    }
  }
]
